supplier_name,country,sector_category,website_domain,tier,supplied_components,org_number
Volvo,SE,Manufacturing,volvokoncernen.se,Tier 1,Engines and heavy machinery,5560125790
Sandvik,SE,Manufacturing,home.sandvik,Tier 1,Mining equipment and machining tools,5560003468
SSAB AB,SE,Metals trader,ssab.com,Tier 2,Specialty steel alloys for heavy industry,5560163429
Ericsson,SE,Electronics,ericsson.com,Tier 2,Telecom and sensor components,5560160680
Saab,SE,Defense,saab.com,Tier 1,Advanced radar and sensor systems,5560360793
Skanska,SE,Construction,skanska.se,Tier 1,Warehousing and infrastructure,5560004615